{
  "$schema": "https://json-schema.org/draft/2020-12/schema",
  "type": "object",
  "properties": {
    "schemaVersion": {
      "type": "number",
      "const": 1
    },
    "id": {
      "type": "string",
      "pattern": "^[a-z][a-z0-9.-]{1,78}[a-z0-9]$"
    },
    "name": {
      "type": "string",
      "minLength": 1,
      "maxLength": 80
    },
    "version": {
      "type": "string",
      "minLength": 1,
      "maxLength": 40
    },
    "description": {
      "type": "string",
      "minLength": 1,
      "maxLength": 2000
    },
    "author": {
      "default": "",
      "type": "string",
      "maxLength": 120
    },
    "configuration": {
      "type": "object",
      "properties": {
        "title": {
          "type": "string",
          "maxLength": 80
        },
        "readTool": {
          "type": "string",
          "pattern": "^[a-zA-Z0-9_-]{1,64}$"
        },
        "writeTool": {
          "type": "string",
          "pattern": "^[a-zA-Z0-9_-]{1,64}$"
        },
        "fields": {
          "maxItems": 20,
          "type": "array",
          "items": {
            "type": "object",
            "properties": {
              "key": {
                "type": "string",
                "pattern": "^[a-zA-Z][a-zA-Z0-9_]{0,39}$"
              },
              "label": {
                "type": "string",
                "minLength": 1,
                "maxLength": 80
              },
              "type": {
                "type": "string",
                "enum": [
                  "text",
                  "number",
                  "time",
                  "weekdays",
                  "select"
                ]
              },
              "options": {
                "maxItems": 20,
                "type": "array",
                "items": {
                  "type": "string",
                  "maxLength": 80
                }
              },
              "min": {
                "type": "number"
              },
              "max": {
                "type": "number"
              }
            },
            "required": [
              "key",
              "label",
              "type"
            ],
            "additionalProperties": false
          }
        }
      },
      "required": [
        "title",
        "readTool",
        "writeTool",
        "fields"
      ],
      "additionalProperties": false
    },
    "reminderTool": {
      "type": "string",
      "pattern": "^[a-zA-Z0-9_-]{1,64}$"
    },
    "transport": {
      "oneOf": [
        {
          "type": "object",
          "properties": {
            "type": {
              "type": "string",
              "const": "stdio"
            },
            "runtime": {
              "type": "string",
              "enum": [
                "executable",
                "node",
                "python"
              ]
            },
            "entry": {
              "type": "string",
              "minLength": 1,
              "maxLength": 500
            },
            "args": {
              "default": [],
              "maxItems": 30,
              "type": "array",
              "items": {
                "type": "string",
                "maxLength": 2000
              }
            }
          },
          "required": [
            "type",
            "runtime",
            "entry",
            "args"
          ],
          "additionalProperties": false
        },
        {
          "type": "object",
          "properties": {
            "type": {
              "type": "string",
              "const": "streamable-http"
            },
            "defaultUrl": {
              "default": "",
              "type": "string",
              "maxLength": 500
            }
          },
          "required": [
            "type",
            "defaultUrl"
          ],
          "additionalProperties": false
        }
      ]
    }
  },
  "required": [
    "schemaVersion",
    "id",
    "name",
    "version",
    "description",
    "author",
    "transport"
  ],
  "additionalProperties": false
}